{"access_counters":{"final_accesses":0,"harness_dev_accesses":0,"selection_accesses":0},"artifacts":{"csv":{"file_sha256":"53b57c505cd675a3611f51b88e92c54944de9519fcc8d1f98899405fdbdd96a4","purpose":"Exact 25-cell aggregate table for journal and audit use.","uri":"outputs/tables/armindex/a12-v16-20260811-r15.cell-eda.v16.csv"},"efficiency_figure_png":{"file_sha256":"af888bb2f333f7a0ec25298be0efc0c5904ee6cac97cc20b5cc0b6a2de6b3784","purpose":"Raster diagnostic figure for latency, wall time, and peak VRAM.","uri":"outputs/figures/armindex/a12-v16-20260811-r15.efficiency-cell-eda.v16.png"},"efficiency_figure_svg":{"file_sha256":"48ac38fc4bf67ef1e3097538cf6600741435f189bb63d60ee75e131e3c9df05a","purpose":"Editable vector diagnostic figure for latency, wall time, and peak VRAM.","uri":"outputs/figures/armindex/a12-v16-20260811-r15.efficiency-cell-eda.v16.svg"},"quality_figure_png":{"file_sha256":"6f24426b1b44262925beabe54156988014919e0e6f6096f5f231ca4307d80f2e","purpose":"Raster paper and slide figure for the three frozen quality metrics.","uri":"outputs/figures/armindex/a12-v16-20260811-r15.quality-cell-eda.v16.png"},"quality_figure_svg":{"file_sha256":"dd3d12a8720d09bd22ba9b17098f51693f52d43a0c863fb382b63c6cad630028","purpose":"Editable vector paper figure for the three frozen quality metrics.","uri":"outputs/figures/armindex/a12-v16-20260811-r15.quality-cell-eda.v16.svg"},"thai_report":{"file_sha256":"475d1fa23bf8d37648cfc7ec4769417c5637b3a4fde9d34b1436ba714a5e77a0","purpose":"Beginner-readable Thai guide and complete 25-cell aggregate table.","uri":"docs/operations/A1_2_R15_CELL_EDA_20260811_TH.md"}},"attempt_id":"a12-v16-20260811-r15","cells":[{"arm_id":"ARM-01","arm_label":"BM25 lexical","cell_id":"ARM-01--P00-TAC-DOC","failure_rate":0.0,"index_size_bytes":95290352,"out_ndcg_at_10":0.1727968904211678,"out_ndcg_at_100":0.1812875611800338,"out_recall_at_100":0.19800000000000015,"peak_host_ram_bytes":0,"peak_vram_bytes":0,"program_id":"P00-TAC-DOC","program_label":"Title + abstract + claims","receipt_file_sha256":"389c472e242140a5db3320457022d7579fc3eb1f5a1f999ef53352c4ef2efefe","receipt_sha256":"1c0e3aa235d54308aaf50a8b9404cecd494812dbdc8da56ae224fcadfdbb515b","replay_count":2,"retry_count":0,"search_latency_p50_ms":146.0076,"search_latency_p95_ms":190.51458999999994,"search_latency_p99_ms":230.04702699999984,"throughput_qps":6.520451227918115,"wall_seconds":111.7110569},{"arm_id":"ARM-01","arm_label":"BM25 lexical","cell_id":"ARM-01--P01-TA-DOC","failure_rate":0.0,"index_size_bytes":33044460,"out_ndcg_at_10":0.09986787617357705,"out_ndcg_at_100":0.11090344776219377,"out_recall_at_100":0.12466666666666676,"peak_host_ram_bytes":0,"peak_vram_bytes":0,"program_id":"P01-TA-DOC","program_label":"Title + abstract","receipt_file_sha256":"20567790148d4d719bff08d433b7a506de6a6eff21f217f267731a415f600f9e","receipt_sha256":"3c0d088038234ee572d95e3a39cf156ecdabcf5155323f77bfd3b714c0485fc6","replay_count":2,"retry_count":0,"search_latency_p50_ms":147.77865,"search_latency_p95_ms":190.46081,"search_latency_p99_ms":210.980247,"throughput_qps":6.626505449266998,"wall_seconds":54.3791098},{"arm_id":"ARM-01","arm_label":"BM25 lexical","cell_id":"ARM-01--P02-CLAIM1","failure_rate":0.0,"index_size_bytes":82998980,"out_ndcg_at_10":0.15985033411039357,"out_ndcg_at_100":0.17034449678156469,"out_recall_at_100":0.1870000000000001,"peak_host_ram_bytes":0,"peak_vram_bytes":0,"program_id":"P02-CLAIM1","program_label":"First claim segment","receipt_file_sha256":"7b84b4e8c05902a53c21e18a9d0f74b6b8c8c243e42374a8998707594e50dada","receipt_sha256":"b67bf4a9acf01a114a354152417808333f80c76c85931f8b10fbf547df506edb","replay_count":2,"retry_count":0,"search_latency_p50_ms":159.82255,"search_latency_p95_ms":203.60635,"search_latency_p99_ms":228.9321279999999,"throughput_qps":6.091032206174427,"wall_seconds":82.5766099},{"arm_id":"ARM-01","arm_label":"BM25 lexical","cell_id":"ARM-01--P03-PASSAGE","failure_rate":0.0,"index_size_bytes":208319732,"out_ndcg_at_10":0.19502414087530942,"out_ndcg_at_100":0.21078362369007603,"out_recall_at_100":0.23466666666666677,"peak_host_ram_bytes":0,"peak_vram_bytes":0,"program_id":"P03-PASSAGE","program_label":"Fixed passages","receipt_file_sha256":"fd74680490ae32edf793e6cdab11a73c96fae9f378f472c2ee59c89a436f86ef","receipt_sha256":"dfcdc31f09c7059b1f39a7ddb4fb534144dfd1db37030c3871ed20bdf20f9b74","replay_count":2,"retry_count":0,"search_latency_p50_ms":653.04665,"search_latency_p95_ms":771.131945,"search_latency_p99_ms":824.073082,"throughput_qps":1.5083448409067293,"wall_seconds":269.4355059},{"arm_id":"ARM-01","arm_label":"BM25 lexical","cell_id":"ARM-01--P04-SECTION-MULTIVIEW","failure_rate":0.0,"index_size_bytes":119712356,"out_ndcg_at_10":0.1725168882664601,"out_ndcg_at_100":0.19026497613351162,"out_recall_at_100":0.21166666666666684,"peak_host_ram_bytes":0,"peak_vram_bytes":0,"program_id":"P04-SECTION-MULTIVIEW","program_label":"Title / abstract / claims views","receipt_file_sha256":"301260c0e3ccc48aa8534e5f2b2ae11f6b72325e7c84d4ef9e40bc41ef0e6467","receipt_sha256":"e053c6659ecea2bebd2902380111e62319878479f4bc661e510e1609a24116d4","replay_count":2,"retry_count":0,"search_latency_p50_ms":648.33815,"search_latency_p95_ms":851.8844499999999,"search_latency_p99_ms":955.0207439999997,"throughput_qps":1.4879024912505903,"wall_seconds":244.4304166},{"arm_id":"ARM-02","arm_label":"BGE-M3 dense","cell_id":"ARM-02--P00-TAC-DOC","failure_rate":0.0,"index_size_bytes":371392512,"out_ndcg_at_10":0.20042600673512606,"out_ndcg_at_100":0.23630337486382264,"out_recall_at_100":0.27333333333333354,"peak_host_ram_bytes":8660365312,"peak_vram_bytes":1345817600,"program_id":"P00-TAC-DOC","program_label":"Title + abstract + claims","receipt_file_sha256":"76d7ab892e802b9f333c4edb7b5753f5f3931cbbf6b8dff05d6a6f2cd46eac2b","receipt_sha256":"d0d47c9b75610ad3a1bfb2480d59d1acd78964aa0d141b28164273a07c8b952d","replay_count":2,"retry_count":0,"search_latency_p50_ms":131.5235845,"search_latency_p95_ms":156.0084463,"search_latency_p99_ms":174.21455375999994,"throughput_qps":5.440715620767034,"wall_seconds":2629.826800015},{"arm_id":"ARM-02","arm_label":"BGE-M3 dense","cell_id":"ARM-02--P01-TA-DOC","failure_rate":0.0,"index_size_bytes":371392512,"out_ndcg_at_10":0.19664505881656288,"out_ndcg_at_100":0.22545285836031106,"out_recall_at_100":0.2589999999999999,"peak_host_ram_bytes":6018248704,"peak_vram_bytes":1338482688,"program_id":"P01-TA-DOC","program_label":"Title + abstract","receipt_file_sha256":"cf554f4ba117a2880376825a74c5cd79a1e532aaf2e81b7c218d698675541669","receipt_sha256":"04a2bf3102040b982d3282d0c5923e6718b41e359350270771cea66e2f7fd6c2","replay_count":2,"retry_count":0,"search_latency_p50_ms":132.8638655,"search_latency_p95_ms":158.49893394999998,"search_latency_p99_ms":163.01840853,"throughput_qps":5.490200918362846,"wall_seconds":1712.855980727},{"arm_id":"ARM-02","arm_label":"BGE-M3 dense","cell_id":"ARM-02--P02-CLAIM1","failure_rate":0.0,"index_size_bytes":371392512,"out_ndcg_at_10":0.18819273557101002,"out_ndcg_at_100":0.21577167522957608,"out_recall_at_100":0.25099999999999983,"peak_host_ram_bytes":8296980480,"peak_vram_bytes":1345817600,"program_id":"P02-CLAIM1","program_label":"First claim segment","receipt_file_sha256":"ff3b014eb286af2c34ee5ea3b7c3f9374481da13391837ec57b6d7ab96cd3698","receipt_sha256":"8eeefcb19d77999a6a5b8ab1d7b8e0881df8a066626e9c9a385f321068d9da2e","replay_count":2,"retry_count":0,"search_latency_p50_ms":138.1767395,"search_latency_p95_ms":181.2250844,"search_latency_p99_ms":197.87444806999994,"throughput_qps":5.248687971217647,"wall_seconds":2560.542840881},{"arm_id":"ARM-02","arm_label":"BGE-M3 dense","cell_id":"ARM-02--P03-PASSAGE","failure_rate":0.0,"index_size_bytes":1477009408,"out_ndcg_at_10":0.22162508668663283,"out_ndcg_at_100":0.25095087548659173,"out_recall_at_100":0.2886666666666668,"peak_host_ram_bytes":16808079360,"peak_vram_bytes":1345817600,"program_id":"P03-PASSAGE","program_label":"Fixed passages","receipt_file_sha256":"6f7544b939cadcd435a700fd1a691042e0d1d71bc0c5a592e845b71648afac45","receipt_sha256":"2c80f1952311d9f11b4e384a1c3571d1a898daa87a84c5e410fea720ba8cd51e","replay_count":2,"retry_count":0,"search_latency_p50_ms":261.5592835,"search_latency_p95_ms":295.13699445,"search_latency_p99_ms":305.3150085299999,"throughput_qps":3.058876513725704,"wall_seconds":7187.733767639},{"arm_id":"ARM-02","arm_label":"BGE-M3 dense","cell_id":"ARM-02--P04-SECTION-MULTIVIEW","failure_rate":0.0,"index_size_bytes":1114177536,"out_ndcg_at_10":0.18559519006675396,"out_ndcg_at_100":0.22840645123852943,"out_recall_at_100":0.2776666666666665,"peak_host_ram_bytes":13619691520,"peak_vram_bytes":1345817600,"program_id":"P04-SECTION-MULTIVIEW","program_label":"Title / abstract / claims views","receipt_file_sha256":"96fd2e96373f22237cf066ec848afd71d8875a35b4f57f757dfc6bf5f0cdeb02","receipt_sha256":"8426a029b1110d58c2b7ac26f24720f0aa9b00978bb6c42f77f4438f6b14e9d0","replay_count":2,"retry_count":0,"search_latency_p50_ms":347.6102305,"search_latency_p95_ms":385.14794035,"search_latency_p99_ms":401.07036746,"throughput_qps":2.499022074684864,"wall_seconds":5756.355267681},{"arm_id":"ARM-03","arm_label":"PatEmbed dense","cell_id":"ARM-03--P00-TAC-DOC","failure_rate":0.0,"index_size_bytes":371392512,"out_ndcg_at_10":0.30311931092576333,"out_ndcg_at_100":0.3548887776262974,"out_recall_at_100":0.4146666666666667,"peak_host_ram_bytes":10166005760,"peak_vram_bytes":710705152,"program_id":"P00-TAC-DOC","program_label":"Title + abstract + claims","receipt_file_sha256":"e47cd58fc7a19fa89fa74eab785532262710c74f1dc78becc8116fdd83a591de","receipt_sha256":"35b923d75e6f87ab03366722554e064f662881e6ad6f195430643ead676720f9","replay_count":2,"retry_count":0,"search_latency_p50_ms":127.423235,"search_latency_p95_ms":149.50783925,"search_latency_p99_ms":161.18841189,"throughput_qps":4.028289612763243,"wall_seconds":5723.242081186},{"arm_id":"ARM-03","arm_label":"PatEmbed dense","cell_id":"ARM-03--P01-TA-DOC","failure_rate":0.0,"index_si